{
  "schema_version": "1.0.0",
  "revision": 8,
  "included_through": 8,
  "repositories": [
    {
      "repository_id": "repo_0190b1c0-0000-7000-8000-000000000001",
      "alias": "main"
    }
  ],
  "workspaces": [
    {
      "workspace_id": "wsp_0190b1c0-0000-7000-8000-000000000001",
      "repository_id": "repo_0190b1c0-0000-7000-8000-000000000001"
    }
  ],
  "topics": [
    {
      "topic_id": "top_0190b1c0-0000-7000-8000-000000000001",
      "project_id": "prj_0190b1c0-0000-7000-8000-000000000001",
      "name": "release-readiness",
      "goal": "Prepare the project for its first public release.",
      "created_by": {
        "kind": "human",
        "id": "alice"
      },
      "created_at": "2026-09-01T09:00:00Z"
    }
  ],
  "tasks": [
    {
      "task_id": "tsk_0190b1c0-0000-7000-8000-000000000001",
      "topic_id": "top_0190b1c0-0000-7000-8000-000000000001",
      "title": "Implement validation for imported records"
    }
  ],
  "declarations": [
    {
      "declaration_id": "dcl_0190b1c0-0000-7000-8000-000000000001",
      "task_id": "tsk_0190b1c0-0000-7000-8000-000000000001",
      "declared_by": {
        "kind": "human",
        "id": "alice"
      },
      "declared_at": "2026-09-01T09:05:00Z",
      "objective": "Implement validation for imported records.",
      "criteria": [
        {
          "criterion_id": "cri_0190b1c0-0000-7000-8000-000000000001",
          "code": "invalid-record-rejected",
          "statement": "An imported record that violates the schema is rejected without partially mutating the store.",
          "required": true
        }
      ]
    }
  ],
  "attempts": [
    {
      "attempt_id": "att_0190b1c0-0000-7000-8000-000000000001",
      "task_id": "tsk_0190b1c0-0000-7000-8000-000000000001",
      "declaration_id": "dcl_0190b1c0-0000-7000-8000-000000000001",
      "repository_id": "repo_0190b1c0-0000-7000-8000-000000000001",
      "workspace_id": "wsp_0190b1c0-0000-7000-8000-000000000001",
      "executor": {
        "kind": "subagent",
        "id": "agent-7"
      },
      "dispatched_by": {
        "kind": "human",
        "id": "alice"
      },
      "dispatched_at": "2026-09-01T10:00:00Z"
    }
  ],
  "attempt_ends": [
    {
      "attempt_end_id": "ate_0190b1c0-0000-7000-8000-000000000001",
      "attempt_id": "att_0190b1c0-0000-7000-8000-000000000001",
      "outcome": "failed",
      "reported_by": {
        "kind": "executor",
        "id": "agent-7"
      },
      "ended_at": "2026-09-03T10:00:00Z",
      "reason": "Executor crashed without a completion claim."
    },
    {
      "attempt_end_id": "ate_0190b1c0-0000-7000-8000-000000000002",
      "attempt_id": "att_0190b1c0-0000-7000-8000-000000000001",
      "outcome": "returned",
      "supersedes": "ate_0190b1c0-0000-7000-8000-000000000001",
      "reported_by": {
        "kind": "executor",
        "id": "agent-7"
      },
      "ended_at": "2026-09-03T10:30:00Z",
      "reason": "Corrected: the executor returned with a completion claim."
    }
  ],
  "claims": [],
  "evidence": [],
  "reconciliations": [],
  "check_invocations": [],
  "check_results": [],
  "verdicts": [],
  "settlements": [],
  "blockers": [],
  "blocker_resolutions": [],
  "decisions": [],
  "project": {
    "project_id": "prj_0190b1c0-0000-7000-8000-000000000001",
    "repositories": [
      {
        "repository_id": "repo_0190b1c0-0000-7000-8000-000000000001",
        "alias": "main"
      }
    ]
  }
}
