{
  "schema_version": "1.0.0",
  "revision": 7,
  "included_through": 7,
  "repositories": [
    {
      "repository_id": "repo_0190b1c0-0000-7000-8000-000000000001",
      "alias": "main"
    }
  ],
  "workspaces": [
    {
      "workspace_id": "wsp_0190b1c0-0000-7000-8000-000000000001",
      "repository_id": "repo_0190b1c0-0000-7000-8000-000000000001"
    }
  ],
  "topics": [
    {
      "topic_id": "top_0190b1c0-0000-7000-8000-000000000001",
      "project_id": "prj_0190b1c0-0000-7000-8000-000000000001",
      "name": "release-readiness",
      "goal": "Prepare the project for its first public release.",
      "created_by": {
        "kind": "human",
        "id": "alice"
      },
      "created_at": "2026-09-01T09:00:00Z"
    }
  ],
  "tasks": [
    {
      "task_id": "tsk_0190b1c0-0000-7000-8000-000000000001",
      "topic_id": "top_0190b1c0-0000-7000-8000-000000000001",
      "title": "Implement validation for imported records"
    }
  ],
  "declarations": [
    {
      "declaration_id": "dcl_0190b1c0-0000-7000-8000-000000000001",
      "task_id": "tsk_0190b1c0-0000-7000-8000-000000000001",
      "declared_by": {
        "kind": "human",
        "id": "alice"
      },
      "declared_at": "2026-09-01T09:05:00Z",
      "objective": "Implement validation for imported records.",
      "criteria": [
        {
          "criterion_id": "cri_0190b1c0-0000-7000-8000-000000000001",
          "code": "invalid-record-rejected",
          "statement": "An imported record that violates the schema is rejected without partially mutating the store.",
          "required": true
        }
      ]
    }
  ],
  "attempts": [
    {
      "attempt_id": "att_0190b1c0-0000-7000-8000-000000000001",
      "task_id": "tsk_0190b1c0-0000-7000-8000-000000000001",
      "declaration_id": "dcl_0190b1c0-0000-7000-8000-000000000001",
      "repository_id": "repo_0190b1c0-0000-7000-8000-000000000001",
      "workspace_id": "wsp_0190b1c0-0000-7000-8000-000000000001",
      "executor": {
        "kind": "subagent",
        "id": "agent-7"
      },
      "dispatched_by": {
        "kind": "human",
        "id": "alice"
      },
      "dispatched_at": "2026-09-01T10:00:00Z"
    }
  ],
  "attempt_ends": [],
  "claims": [
    {
      "claim_id": "clm_0190b1c0-0000-7000-8000-000000000001",
      "task_id": "tsk_0190b1c0-0000-7000-8000-000000000001",
      "attempt_id": "att_0190b1c0-0000-7000-8000-000000000001",
      "declaration_id": "dcl_0190b1c0-0000-7000-8000-000000000001",
      "statement": "The declared validation work is complete.",
      "evidence_ids": [],
      "claimed_by": {
        "kind": "executor",
        "id": "agent-7"
      },
      "claimed_at": "2026-09-02T11:00:00Z"
    }
  ],
  "evidence": [],
  "reconciliations": [],
  "check_invocations": [],
  "check_results": [],
  "verdicts": [
    {
      "verdict_id": "ver_0190b1c0-0000-7000-8000-000000000001",
      "subject": {
        "kind": "claim",
        "id": "clm_0190b1c0-0000-7000-8000-000000000001"
      },
      "declaration_id": "dcl_0190b1c0-0000-7000-8000-000000000001",
      "scope": {
        "evaluated_criteria": [
          "cri_0190b1c0-0000-7000-8000-000000000001"
        ],
        "unevaluated_criteria": []
      },
      "conclusion": "supported",
      "finality": "final",
      "basis": {
        "evidence_ids": [],
        "reconciliation_ids": []
      },
      "findings": [
        {
          "criterion_id": "cri_0190b1c0-0000-7000-8000-000000000001",
          "assessment": "supported",
          "summary": "The declared criterion resolves within the named declaration.",
          "basis_refs": []
        }
      ],
      "confidence": {
        "level": "high",
        "rationale": "n/a"
      },
      "rationale": "The verdict's declaration and criterion references all resolve.",
      "uncertainty": [],
      "limitations": [],
      "issued_by": {
        "kind": "tool",
        "id": "tallyback-check"
      },
      "issued_at": "2026-09-02T13:00:00Z",
      "checker": {
        "id": "done-or-not",
        "version": "1"
      },
      "native_judgment": {
        "namespace": "done-or-not",
        "schema_version": "1",
        "payload": {}
      }
    }
  ],
  "settlements": [],
  "blockers": [],
  "blocker_resolutions": [],
  "decisions": [],
  "project": {
    "project_id": "prj_0190b1c0-0000-7000-8000-000000000001",
    "repositories": [
      {
        "repository_id": "repo_0190b1c0-0000-7000-8000-000000000001",
        "alias": "main"
      }
    ]
  }
}
