{
  "schema_version": "1.0.0",
  "revision": 6,
  "included_through": 6,
  "repositories": [
    {
      "repository_id": "repo_0190b1c0-0000-7000-8000-000000000001",
      "alias": "main"
    }
  ],
  "workspaces": [
    {
      "workspace_id": "wsp_0190b1c0-0000-7000-8000-000000000001",
      "repository_id": "repo_0190b1c0-0000-7000-8000-000000000001"
    }
  ],
  "topics": [
    {
      "topic_id": "top_0190b1c0-0000-7000-8000-000000000001",
      "project_id": "prj_0190b1c0-0000-7000-8000-000000000001",
      "name": "release-readiness",
      "goal": "Prepare the project for its first public release.",
      "created_by": {
        "kind": "human",
        "id": "alice"
      },
      "created_at": "2026-09-01T09:00:00Z"
    }
  ],
  "tasks": [
    {
      "task_id": "tsk_0190b1c0-0000-7000-8000-000000000001",
      "topic_id": "top_0190b1c0-0000-7000-8000-000000000001",
      "title": "Implement validation for imported records"
    }
  ],
  "declarations": [
    {
      "declaration_id": "dcl_0190b1c0-0000-7000-8000-000000000001",
      "task_id": "tsk_0190b1c0-0000-7000-8000-000000000001",
      "declared_by": {
        "kind": "human",
        "id": "alice"
      },
      "declared_at": "2026-09-01T09:05:00Z",
      "objective": "Implement validation for imported records.",
      "criteria": [
        {
          "criterion_id": "cri_0190b1c0-0000-7000-8000-000000000001",
          "code": "invalid-record-rejected",
          "statement": "An imported record that violates the schema is rejected without partially mutating the store.",
          "required": true
        }
      ]
    }
  ],
  "attempts": [
    {
      "attempt_id": "att_0190b1c0-0000-7000-8000-000000000001",
      "task_id": "tsk_0190b1c0-0000-7000-8000-000000000001",
      "declaration_id": "dcl_0190b1c0-0000-7000-8000-000000000001",
      "repository_id": "repo_0190b1c0-0000-7000-8000-000000000001",
      "workspace_id": "wsp_0190b1c0-0000-7000-8000-000000000001",
      "executor": {
        "kind": "subagent",
        "id": "agent-7"
      },
      "dispatched_by": {
        "kind": "human",
        "id": "alice"
      },
      "dispatched_at": "2026-09-01T10:00:00Z"
    }
  ],
  "attempt_ends": [],
  "claims": [],
  "evidence": [],
  "reconciliations": [],
  "check_invocations": [],
  "check_results": [],
  "verdicts": [],
  "settlements": [
    {
      "settlement_id": "set_0190b1c0-0000-7000-8000-000000000001",
      "task_id": "tsk_0190b1c0-0000-7000-8000-000000000001",
      "attempt_id": "att_0190b1c0-0000-7000-8000-000000000001",
      "decision": "accept",
      "decided_by": {
        "kind": "human",
        "id": "alice"
      },
      "decided_at": "2026-09-02T14:00:00Z",
      "basis": {
        "verdict_id": null,
        "attempt_end_id": null,
        "blocker_ids": []
      },
      "verification_exception": "Manual inspection by alice substituted for a verdict.",
      "rationale": "Accepted via explicit verification exception."
    },
    {
      "settlement_id": "set_0190b1c0-0000-7000-8000-000000000002",
      "task_id": "tsk_0190b1c0-0000-7000-8000-000000000001",
      "attempt_id": "att_0190b1c0-0000-7000-8000-000000000001",
      "decision": "retry",
      "supersedes": "set_0190b1c0-0000-7000-8000-000000000001",
      "decided_by": {
        "kind": "human",
        "id": "alice"
      },
      "decided_at": "2026-09-03T14:00:00Z",
      "basis": {
        "verdict_id": null,
        "attempt_end_id": null,
        "blocker_ids": []
      },
      "verification_exception": null,
      "rationale": "Reopened after a defect was found in review."
    }
  ],
  "blockers": [],
  "blocker_resolutions": [],
  "decisions": [],
  "project": {
    "project_id": "prj_0190b1c0-0000-7000-8000-000000000001",
    "repositories": [
      {
        "repository_id": "repo_0190b1c0-0000-7000-8000-000000000001",
        "alias": "main"
      }
    ]
  }
}
