{
  "schema_version": "1.0.0",
  "revision": 8,
  "included_through": 8,
  "project": {
    "project_id": "prj_01a0d74d-51aa-7345-acd4-632e769e3552",
    "repositories": [
      {
        "repository_id": "repo_01a0d74d-51aa-7345-acd4-67ab28123d08",
        "alias": "main"
      }
    ]
  },
  "repositories": [
    {
      "repository_id": "repo_01a0d74d-51aa-7345-acd4-67ab28123d08",
      "alias": "main"
    }
  ],
  "workspaces": [
    {
      "workspace_id": "wsp_01a0d74e-34cd-763c-9f22-83ae8df6f194",
      "repository_id": "repo_01a0d74d-51aa-7345-acd4-67ab28123d08"
    }
  ],
  "topics": [
    {
      "topic_id": "top_01a0d74d-612b-70b1-ae44-49554ff72e67",
      "project_id": "prj_01a0d74d-51aa-7345-acd4-632e769e3552",
      "name": "Bug fixes",
      "goal": "",
      "created_by": {
        "kind": "tool",
        "id": "tallyback"
      },
      "created_at": "2026-09-25T06:42:47.723Z"
    }
  ],
  "tasks": [
    {
      "task_id": "tsk_01a0d74d-70f7-730e-94b6-e26636a609b5",
      "topic_id": "top_01a0d74d-612b-70b1-ae44-49554ff72e67",
      "title": "Fix expired cache entries bug"
    }
  ],
  "declarations": [
    {
      "declaration_id": "dcl_01a0d74d-8d50-73ad-a6ef-bfd9832fbbb8",
      "task_id": "tsk_01a0d74d-70f7-730e-94b6-e26636a609b5",
      "declared_by": {
        "kind": "tool",
        "id": "tallyback"
      },
      "declared_at": "2026-09-25T06:42:59.025Z",
      "objective": "An expired cache entry is recomputed once and the refreshed value stays cached until its new TTL expires",
      "criteria": []
    }
  ],
  "attempts": [
    {
      "attempt_id": "att_01a0d74e-4245-7619-a555-bc68dca4f6ab",
      "task_id": "tsk_01a0d74d-70f7-730e-94b6-e26636a609b5",
      "declaration_id": "dcl_01a0d74d-8d50-73ad-a6ef-bfd9832fbbb8",
      "repository_id": "repo_01a0d74d-51aa-7345-acd4-67ab28123d08",
      "workspace_id": "wsp_01a0d74e-34cd-763c-9f22-83ae8df6f194",
      "executor": {
        "kind": "tool",
        "id": "tallyback"
      },
      "dispatched_by": {
        "kind": "tool",
        "id": "tallyback"
      },
      "dispatched_at": "2026-09-25T06:43:45.349Z"
    }
  ],
  "attempt_ends": [
    {
      "attempt_end_id": "ate_01a0d74f-0acb-7078-82db-895216ab4e6f",
      "attempt_id": "att_01a0d74e-4245-7619-a555-bc68dca4f6ab",
      "outcome": "returned",
      "reported_by": {
        "kind": "tool",
        "id": "tallyback"
      },
      "ended_at": "2026-09-25T06:44:36.683Z"
    }
  ],
  "claims": [
    {
      "claim_id": "clm_01a0d74e-6bc3-747e-950a-fa5071a5b6d3",
      "task_id": "tsk_01a0d74d-70f7-730e-94b6-e26636a609b5",
      "attempt_id": "att_01a0d74e-4245-7619-a555-bc68dca4f6ab",
      "declaration_id": "dcl_01a0d74d-8d50-73ad-a6ef-bfd9832fbbb8",
      "statement": "Added regression test and fixed bug where expired cache entries were not staying cached",
      "evidence_ids": [],
      "claimed_by": {
        "kind": "tool",
        "id": "tallyback"
      },
      "claimed_at": "2026-09-25T06:43:55.971Z"
    }
  ],
  "evidence": [],
  "reconciliations": [],
  "check_invocations": [
    {
      "check_invocation_id": "chk_01a0d74e-c05e-73fc-baf9-c1caba1297b7",
      "subject": {
        "kind": "claim",
        "id": "clm_01a0d74e-6bc3-747e-950a-fa5071a5b6d3"
      },
      "checker": {
        "id": "pytest",
        "version": "8.3.3"
      },
      "evaluated_snapshot": {
        "project_id": "prj_01a0d74d-51aa-7345-acd4-632e769e3552",
        "revision": 6,
        "digest": {
          "algorithm": "sha-256",
          "value": "b7303210a2c9a24c45f18528fb4d72d270d4a17d04839d2e91b8212df235c60f"
        }
      },
      "invoked_by": {
        "kind": "tool",
        "id": "tallyback-check"
      },
      "invoked_at": "2026-09-25T06:44:17.630Z"
    }
  ],
  "check_results": [],
  "verdicts": [],
  "settlements": [],
  "blockers": [],
  "blocker_resolutions": [],
  "decisions": []
}
