{
  "schema_version": "1.0.0",
  "revision": 8,
  "included_through": 8,
  "repositories": [
    {
      "repository_id": "repo_0190b1c0-0000-7000-8000-000000000001",
      "alias": "main"
    }
  ],
  "workspaces": [
    {
      "workspace_id": "wsp_0190b1c0-0000-7000-8000-000000000001",
      "repository_id": "repo_0190b1c0-0000-7000-8000-000000000001"
    }
  ],
  "topics": [
    {
      "topic_id": "top_0190b1c0-0000-7000-8000-000000000001",
      "project_id": "prj_0190b1c0-0000-7000-8000-000000000001",
      "name": "release-readiness",
      "goal": "Prepare the project for its first public release.",
      "created_by": {
        "kind": "human",
        "id": "alice"
      },
      "created_at": "2026-09-01T09:00:00Z"
    }
  ],
  "tasks": [
    {
      "task_id": "tsk_0190b1c0-0000-7000-8000-000000000001",
      "topic_id": "top_0190b1c0-0000-7000-8000-000000000001",
      "title": "Implement validation for imported records"
    }
  ],
  "declarations": [
    {
      "declaration_id": "dcl_0190b1c0-0000-7000-8000-000000000001",
      "task_id": "tsk_0190b1c0-0000-7000-8000-000000000001",
      "declared_by": {
        "kind": "human",
        "id": "alice"
      },
      "declared_at": "2026-09-01T09:05:00Z",
      "objective": "Implement validation for imported records.",
      "criteria": [
        {
          "criterion_id": "cri_0190b1c0-0000-7000-8000-000000000001",
          "code": "invalid-record-rejected",
          "statement": "An imported record that violates the schema is rejected without partially mutating the store.",
          "required": true
        }
      ]
    }
  ],
  "attempts": [
    {
      "attempt_id": "att_0190b1c0-0000-7000-8000-000000000001",
      "task_id": "tsk_0190b1c0-0000-7000-8000-000000000001",
      "declaration_id": "dcl_0190b1c0-0000-7000-8000-000000000001",
      "repository_id": "repo_0190b1c0-0000-7000-8000-000000000001",
      "workspace_id": "wsp_0190b1c0-0000-7000-8000-000000000001",
      "executor": {
        "kind": "subagent",
        "id": "agent-7"
      },
      "dispatched_by": {
        "kind": "human",
        "id": "alice"
      },
      "dispatched_at": "2026-09-01T10:00:00Z"
    }
  ],
  "attempt_ends": [],
  "claims": [
    {
      "claim_id": "clm_0190b1c0-0000-7000-8000-000000000001",
      "task_id": "tsk_0190b1c0-0000-7000-8000-000000000001",
      "attempt_id": "att_0190b1c0-0000-7000-8000-000000000001",
      "declaration_id": "dcl_0190b1c0-0000-7000-8000-000000000001",
      "statement": "The declared validation work is complete.",
      "evidence_ids": [],
      "claimed_by": {
        "kind": "executor",
        "id": "agent-7"
      },
      "claimed_at": "2026-09-02T11:00:00Z"
    }
  ],
  "evidence": [],
  "reconciliations": [],
  "check_invocations": [
    {
      "check_invocation_id": "chk_0190b1c0-0000-7000-8000-000000000001",
      "subject": {
        "kind": "claim",
        "id": "clm_0190b1c0-0000-7000-8000-000000000001"
      },
      "checker": {
        "id": "done-or-not",
        "version": "1"
      },
      "evaluated_snapshot": {
        "project_id": "prj_0190b1c0-0000-7000-8000-000000000001",
        "revision": 7,
        "digest": {
          "algorithm": "sha-256",
          "value": "e3b0c44298fc1c149afbf4c8996fb92427ae41e4649b934ca495991b7852b855"
        }
      },
      "invoked_by": {
        "kind": "tool",
        "id": "tallyback-check"
      },
      "invoked_at": "2026-09-02T12:00:00Z"
    }
  ],
  "check_results": [
    {
      "check_result_id": "ckr_0190b1c0-0000-7000-8000-000000000001",
      "check_invocation_id": "chk_0190b1c0-0000-7000-8000-000000000001",
      "outcome": "verdict_withheld",
      "produced_by": {
        "kind": "tool",
        "id": "tallyback-check"
      },
      "completed_at": "2026-09-02T12:10:00Z",
      "diagnostics": [
        {
          "code": "declaration_semantics_missing",
          "message": "No usable TaskDeclaration acceptance criteria were available for the subject claim."
        }
      ],
      "reconciliation_ids": [],
      "verdict_id": null
    }
  ],
  "verdicts": [],
  "settlements": [],
  "blockers": [],
  "blocker_resolutions": [],
  "decisions": [],
  "project": {
    "project_id": "prj_0190b1c0-0000-7000-8000-000000000001",
    "repositories": [
      {
        "repository_id": "repo_0190b1c0-0000-7000-8000-000000000001",
        "alias": "main"
      }
    ]
  }
}
