{
  "schema_version": "1.0.0",
  "revision": 6,
  "included_through": 6,
  "project": {
    "project_id": "prj_01a0d84a-86d2-70ef-bd19-59ecd0e97845",
    "repositories": [
      {
        "repository_id": "repo_01a0d84a-86d2-70ef-bd19-5cf7919452f2",
        "alias": "main"
      }
    ]
  },
  "repositories": [
    {
      "repository_id": "repo_01a0d84a-86d2-70ef-bd19-5cf7919452f2",
      "alias": "main"
    }
  ],
  "workspaces": [
    {
      "workspace_id": "wsp_01a0d84b-1663-725b-bf50-ab54f511ac08",
      "repository_id": "repo_01a0d84a-86d2-70ef-bd19-5cf7919452f2",
      "branch": "main"
    }
  ],
  "topics": [
    {
      "topic_id": "top_01a0d84a-91dc-77b7-94a2-4da6509f0007",
      "project_id": "prj_01a0d84a-86d2-70ef-bd19-59ecd0e97845",
      "name": "v1-config-migration-fix",
      "goal": "",
      "created_by": {
        "kind": "unknown",
        "id": "unattributed"
      },
      "created_at": "2026-09-25T11:19:20.797Z"
    }
  ],
  "tasks": [
    {
      "task_id": "tsk_01a0d84a-ab38-72de-851f-1de1935ad3d2",
      "topic_id": "top_01a0d84a-91dc-77b7-94a2-4da6509f0007",
      "title": "Fix v1->v2 config migration losing unknown keys"
    }
  ],
  "declarations": [
    {
      "declaration_id": "dcl_01a0d84a-faf7-711c-a359-aa88fee10fcb",
      "task_id": "tsk_01a0d84a-ab38-72de-851f-1de1935ad3d2",
      "declared_by": {
        "kind": "executor",
        "id": "claude-code"
      },
      "declared_at": "2026-09-25T11:19:47.704Z",
      "objective": "Fix v1->v2 config migration so it preserves all unrelated user-defined keys recursively, renames timeout->request_timeout, sets version=2, does not mutate input, and has regression coverage",
      "criteria": [
        {
          "criterion_id": "cri_01a0d84a-faf8-7387-b9aa-a5602c1a04e8",
          "code": "rename",
          "statement": "timeout key is renamed to request_timeout",
          "required": true
        },
        {
          "criterion_id": "cri_01a0d84a-faf8-7387-b9aa-a80773de208b",
          "code": "version",
          "statement": "version field is set to 2",
          "required": true
        },
        {
          "criterion_id": "cri_01a0d84a-faf8-7387-b9aa-acc9293f3833",
          "code": "preserve",
          "statement": "all unrelated user-defined keys (including nested) are preserved",
          "required": true
        },
        {
          "criterion_id": "cri_01a0d84a-faf8-7387-b9aa-b36be2cca495",
          "code": "immutable",
          "statement": "the input config object is not mutated",
          "required": true
        },
        {
          "criterion_id": "cri_01a0d84a-faf8-7387-b9aa-b73867991a01",
          "code": "test",
          "statement": "regression test exists covering preservation of unknown keys",
          "required": true
        }
      ]
    }
  ],
  "attempts": [
    {
      "attempt_id": "att_01a0d84b-2a38-74ec-af26-d3669c565059",
      "task_id": "tsk_01a0d84a-ab38-72de-851f-1de1935ad3d2",
      "declaration_id": "dcl_01a0d84a-faf7-711c-a359-aa88fee10fcb",
      "repository_id": "repo_01a0d84a-86d2-70ef-bd19-5cf7919452f2",
      "workspace_id": "wsp_01a0d84b-1663-725b-bf50-ab54f511ac08",
      "executor": {
        "kind": "executor",
        "id": "claude-code"
      },
      "dispatched_by": {
        "kind": "unknown",
        "id": "unattributed"
      },
      "dispatched_at": "2026-09-25T11:19:59.801Z"
    }
  ],
  "attempt_ends": [],
  "claims": [],
  "evidence": [],
  "reconciliations": [],
  "check_invocations": [],
  "check_results": [],
  "verdicts": [],
  "settlements": [],
  "blockers": [],
  "blocker_resolutions": [],
  "decisions": [
    {
      "decision_id": "dec_01a0d84b-4483-727a-ad10-8639438353ee",
      "subject": {
        "kind": "attempt",
        "id": "att_01a0d84b-2a38-74ec-af26-d3669c565059"
      },
      "role": "execution_choice",
      "question": "Execution fit",
      "choice": "FIT: root cause is _v1_to_v2 rebuilding a fresh dict, dropping unknown keys; fix + tests are straightforward and verifiable",
      "rationale": "criteria: all 5 acceptance criteria understood and map directly to code changes; capability: pure Python dict manipulation, well within capability; verification: pytest regression tests give direct evidence for rename/version/preserve/test criteria, and can add an explicit mutation-check test for immutable; tools/authority: have edit+test tools, will not settle land or push without being asked",
      "decided_by": {
        "kind": "executor",
        "id": "claude-code"
      },
      "decided_at": "2026-09-25T11:20:06.532Z",
      "basis": []
    }
  ]
}
