{
  "schema_version": "1.0.0",
  "revision": 6,
  "included_through": 6,
  "project": {
    "project_id": "prj_01a0d84f-2a26-73e8-8b1c-3c9c3c88db8e",
    "repositories": [
      {
        "repository_id": "repo_01a0d84f-2a26-73e8-8b1c-4335d25f006d",
        "alias": "main"
      }
    ]
  },
  "repositories": [
    {
      "repository_id": "repo_01a0d84f-2a26-73e8-8b1c-4335d25f006d",
      "alias": "main"
    }
  ],
  "workspaces": [
    {
      "workspace_id": "wsp_01a0d84f-774c-72aa-a170-2853992e9218",
      "repository_id": "repo_01a0d84f-2a26-73e8-8b1c-4335d25f006d",
      "branch": "main"
    }
  ],
  "topics": [
    {
      "topic_id": "top_01a0d84f-3ab4-7253-b31b-782a37e01ba5",
      "project_id": "prj_01a0d84f-2a26-73e8-8b1c-3c9c3c88db8e",
      "name": "config-migration-fix",
      "goal": "",
      "created_by": {
        "kind": "unknown",
        "id": "unattributed"
      },
      "created_at": "2026-09-25T11:24:26.164Z"
    }
  ],
  "tasks": [
    {
      "task_id": "tsk_01a0d84f-4b61-7299-b289-9bdfa76dbec7",
      "topic_id": "top_01a0d84f-3ab4-7253-b31b-782a37e01ba5",
      "title": "Preserve user-defined keys in v1-to-v2 config migration"
    }
  ],
  "declarations": [
    {
      "declaration_id": "dcl_01a0d84f-60fb-75ec-9daa-76f060df469b",
      "task_id": "tsk_01a0d84f-4b61-7299-b289-9bdfa76dbec7",
      "declared_by": {
        "kind": "unknown",
        "id": "unattributed"
      },
      "declared_at": "2026-09-25T11:24:35.963Z",
      "objective": "Fix config migration to preserve user-defined keys and rename timeout correctly",
      "criteria": [
        {
          "criterion_id": "cri_01a0d84f-60fb-75ec-9daa-7ae71f814187",
          "code": "c1",
          "statement": "Rename timeout to request_timeout",
          "required": true
        },
        {
          "criterion_id": "cri_01a0d84f-60fb-75ec-9daa-7d143eb9da6c",
          "code": "c2",
          "statement": "Set version to 2",
          "required": true
        },
        {
          "criterion_id": "cri_01a0d84f-60fb-75ec-9daa-81cc71768b7a",
          "code": "c3",
          "statement": "Preserve all unrelated user-defined keys recursively",
          "required": true
        },
        {
          "criterion_id": "cri_01a0d84f-60fb-75ec-9daa-8601f0672f2c",
          "code": "c4",
          "statement": "Do not mutate the input object",
          "required": true
        },
        {
          "criterion_id": "cri_01a0d84f-60fb-75ec-9daa-8b47843dd238",
          "code": "c5",
          "statement": "Add regression coverage for preservation of unknown keys",
          "required": true
        }
      ]
    }
  ],
  "attempts": [
    {
      "attempt_id": "att_01a0d84f-8df5-7529-9bb7-e59eda227479",
      "task_id": "tsk_01a0d84f-4b61-7299-b289-9bdfa76dbec7",
      "declaration_id": "dcl_01a0d84f-60fb-75ec-9daa-76f060df469b",
      "repository_id": "repo_01a0d84f-2a26-73e8-8b1c-4335d25f006d",
      "workspace_id": "wsp_01a0d84f-774c-72aa-a170-2853992e9218",
      "executor": {
        "kind": "executor",
        "id": "claude-code"
      },
      "dispatched_by": {
        "kind": "unknown",
        "id": "unattributed"
      },
      "dispatched_at": "2026-09-25T11:24:47.477Z"
    }
  ],
  "attempt_ends": [],
  "claims": [],
  "evidence": [],
  "reconciliations": [],
  "check_invocations": [],
  "check_results": [],
  "verdicts": [],
  "settlements": [],
  "blockers": [],
  "blocker_resolutions": [],
  "decisions": [
    {
      "decision_id": "dec_01a0d84f-ab8d-7658-881a-d7ec29245480",
      "subject": {
        "kind": "attempt",
        "id": "att_01a0d84f-8df5-7529-9bb7-e59eda227479"
      },
      "role": "execution_choice",
      "question": "Execution fit",
      "choice": "FIT: Clear path to implement and verify all criteria",
      "rationale": "criteria: all acceptance criteria are well-defined and straightforward; capability: I understand Python and can modify the migration code; verification: can run test suite and create new regression tests; tools/authority: have file edit access and can commit changes locally",
      "decided_by": {
        "kind": "executor",
        "id": "claude-code"
      },
      "decided_at": "2026-09-25T11:24:55.054Z",
      "basis": []
    }
  ]
}
